[
  {
    "id": "AST-PC-305-01",
    "code": "TS-2024-00101",
    "name": "Máy tính trạm Dell OptiPlex 7090",
    "category": "computer",
    "room_id": "lab-a1-305",
    "room_code": "A1-305",
    "org_path": "/haui/sict/khmt/lab-a1-305",
    "tech_unit_path": "/haui/tt-cntt",
    "model": "Dell OptiPlex 7090 Tower",
    "serial_number": "SN-DELL-7090-00101",
    "purchase_year": 2023,
    "warranty_expiry": "2026-12-31",
    "original_value_vnd": 24500000,
    "current_value_vnd": 18000000,
    "status": "in_use",
    "specifications": {
      "cpu": "Intel Core i7-11700",
      "ram": "32GB DDR4",
      "storage": "512GB NVMe SSD + 1TB HDD",
      "os": "Ubuntu 24.04 LTS"
    }
  },
  {
    "id": "AST-PC-305-02",
    "code": "TS-2024-00102",
    "name": "Máy tính giảng viên HP ProDesk 400 G7",
    "category": "computer",
    "room_id": "lab-a1-305",
    "room_code": "A1-305",
    "org_path": "/haui/sict/khmt/lab-a1-305",
    "tech_unit_path": "/haui/tt-cntt",
    "model": "HP ProDesk 400 G7 SFF",
    "serial_number": "SN-HP-400G7-00102",
    "purchase_year": 2023,
    "warranty_expiry": "2026-11-30",
    "original_value_vnd": 19500000,
    "current_value_vnd": 14000000,
    "status": "in_use",
    "specifications": {
      "cpu": "Intel Core i5-10500",
      "ram": "16GB DDR4",
      "storage": "256GB SSD",
      "os": "Windows 11 Pro Education"
    }
  },
  {
    "id": "AST-PROJ-305-01",
    "code": "TS-2024-00201",
    "name": "Máy chiếu Panasonic PT-LB385",
    "category": "projector",
    "room_id": "lab-a1-305",
    "room_code": "A1-305",
    "org_path": "/haui/sict/khmt/lab-a1-305",
    "tech_unit_path": "/haui/tt-cntt",
    "model": "Panasonic PT-LB385 LCD Projector",
    "serial_number": "SN-PANA-LB385-00201",
    "purchase_year": 2022,
    "warranty_expiry": "2024-09-30",
    "original_value_vnd": 16800000,
    "current_value_vnd": 9500000,
    "status": "in_use",
    "specifications": {
      "brightness_lumens": 3800,
      "resolution": "XGA 1024x768",
      "ports": "HDMI x2, VGA x1, Audio In/Out",
      "lamp_hours": 1250
    }
  },
  {
    "id": "AST-AC-305-01",
    "code": "TS-2024-00301",
    "name": "Điều hòa âm trần Daikin 24000 BTU",
    "category": "hvac",
    "room_id": "lab-a1-305",
    "room_code": "A1-305",
    "org_path": "/haui/sict/khmt/lab-a1-305",
    "tech_unit_path": "/haui/ban-csvc",
    "model": "Daikin FCF71CVM / RCF71CVM",
    "serial_number": "SN-DAIKIN-FCF71-00301",
    "purchase_year": 2022,
    "warranty_expiry": "2025-05-31",
    "original_value_vnd": 28900000,
    "current_value_vnd": 19000000,
    "status": "in_use",
    "specifications": {
      "cooling_capacity_btu": 24000,
      "refrigerant": "R32",
      "power_supply": "1 pha, 220-240V, 50Hz"
    }
  },
  {
    "id": "AST-LIGHT-305-01",
    "code": "TS-2024-00401",
    "name": "Hệ thống máng đèn LED đôi 1.2m Rạng Đông",
    "category": "electrical",
    "room_id": "lab-a1-305",
    "room_code": "A1-305",
    "org_path": "/haui/sict/khmt/lab-a1-305",
    "tech_unit_path": "/haui/ban-csvc",
    "model": "Rạng Đông BD T8 M11/36Wx2",
    "serial_number": "SN-RD-T8-00401",
    "purchase_year": 2023,
    "warranty_expiry": "2025-10-31",
    "original_value_vnd": 3200000,
    "current_value_vnd": 2100000,
    "status": "in_use",
    "specifications": {
      "tubes": 2,
      "power_w": 36,
      "color_temp": "6500K Ánh sáng trắng",
      "voltage": "220V/50Hz"
    }
  },
  {
    "id": "AST-PC-306-01",
    "code": "TS-2024-00103",
    "name": "Máy tính trạm Dell Precision 3650",
    "category": "computer",
    "room_id": "lab-a1-306",
    "room_code": "A1-306",
    "org_path": "/haui/sict/khmt/lab-a1-306",
    "tech_unit_path": "/haui/tt-cntt",
    "model": "Dell Precision 3650 Tower",
    "serial_number": "SN-DELL-PRE3650-00103",
    "purchase_year": 2024,
    "warranty_expiry": "2027-02-28",
    "original_value_vnd": 35000000,
    "current_value_vnd": 31000000,
    "status": "in_use",
    "specifications": {
      "cpu": "Intel Core i7-11700K",
      "ram": "32GB DDR4",
      "gpu": "NVIDIA T1000 4GB",
      "storage": "1TB NVMe SSD",
      "os": "Ubuntu 24.04 LTS"
    }
  },
  {
    "id": "AST-SW-601-01",
    "code": "TS-2024-00501",
    "name": "Switch quản lý Cisco Catalyst 2960-X 48 Port",
    "category": "network",
    "room_id": "lab-a1-601",
    "room_code": "A1-601",
    "org_path": "/haui/sict/mmt/lab-a1-601",
    "tech_unit_path": "/haui/tt-cntt",
    "model": "WS-C2960X-48TS-L",
    "serial_number": "SN-CISCO-2960X-00501",
    "purchase_year": 2022,
    "warranty_expiry": "2025-08-31",
    "original_value_vnd": 42000000,
    "current_value_vnd": 27000000,
    "status": "in_use",
    "specifications": {
      "ports": "48x 10/100/1000 Ethernet, 4x 1G SFP",
      "switching_capacity": "216 Gbps",
      "firmware": "Cisco IOS 15.2(7)E10"
    }
  },
  {
    "id": "AST-WIFI-601-01",
    "code": "TS-2024-00502",
    "name": "Bộ phát WiFi chuyên dụng Aruba AP-515",
    "category": "network",
    "room_id": "lab-a1-601",
    "room_code": "A1-601",
    "org_path": "/haui/sict/mmt/lab-a1-601",
    "tech_unit_path": "/haui/tt-cntt",
    "model": "Aruba Instant AP-515 (RW)",
    "serial_number": "SN-ARUBA-AP515-00502",
    "purchase_year": 2023,
    "warranty_expiry": "2026-06-30",
    "original_value_vnd": 14500000,
    "current_value_vnd": 11000000,
    "status": "in_use",
    "specifications": {
      "standard": "Wi-Fi 6 (802.11ax)",
      "throughput_mbps": 2690,
      "poe": "802.3at PoE+",
      "bands": "Dual Band 2.4GHz / 5GHz"
    }
  },
  {
    "id": "AST-PRINT-601-01",
    "code": "TS-2024-00601",
    "name": "Máy in đa năng HP LaserJet Enterprise MFP M430f",
    "category": "printer",
    "room_id": "lab-a1-601",
    "room_code": "A1-601",
    "org_path": "/haui/sict/mmt/lab-a1-601",
    "tech_unit_path": "/haui/tt-cntt",
    "model": "HP LaserJet Enterprise MFP M430f",
    "serial_number": "SN-HP-M430F-00601",
    "purchase_year": 2023,
    "warranty_expiry": "2025-12-31",
    "original_value_vnd": 15800000,
    "current_value_vnd": 11500000,
    "status": "in_use",
    "specifications": {
      "functions": "In, Scan, Copy, Fax",
      "print_speed_ppm": 40,
      "duplex": "Tự động đảo mặt",
      "connectivity": "Gigabit Ethernet, USB 2.0"
    }
  },
  {
    "id": "AST-OSC-201-01",
    "code": "TS-2024-00701",
    "name": "Dao động ký số 4 kênh Rigol DS1054Z",
    "category": "lab_instrument",
    "room_id": "lab-a10-201",
    "room_code": "A10-201",
    "org_path": "/haui/truong-dien-dien-tu/khoa-dien/lab-a10-201",
    "tech_unit_path": "/haui/truong-dien-dien-tu/khoa-dien",
    "model": "Rigol DS1054Z Digital Oscilloscope",
    "serial_number": "SN-RIGOL-DS1054Z-00701",
    "purchase_year": 2023,
    "warranty_expiry": "2026-03-31",
    "original_value_vnd": 12500000,
    "current_value_vnd": 9800000,
    "status": "in_use",
    "specifications": {
      "bandwidth_mhz": 50,
      "channels": 4,
      "sample_rate_gsa_s": 1,
      "memory_depth": "24 Mpts",
      "display": "7 inch WVGA LCD"
    }
  },
  {
    "id": "AST-DMM-201-01",
    "code": "TS-2024-00702",
    "name": "Đồng hồ vạn năng hiện số Fluke 87V Industrial",
    "category": "lab_instrument",
    "room_id": "lab-a10-201",
    "room_code": "A10-201",
    "org_path": "/haui/truong-dien-dien-tu/khoa-dien/lab-a10-201",
    "tech_unit_path": "/haui/truong-dien-dien-tu/khoa-dien",
    "model": "Fluke 87-V True-RMS Digital Multimeter",
    "serial_number": "SN-FLUKE-87V-00702",
    "purchase_year": 2022,
    "warranty_expiry": "2027-05-31",
    "original_value_vnd": 11200000,
    "current_value_vnd": 8900000,
    "status": "in_use",
    "specifications": {
      "measuring_range": "1000V AC/DC, 10A, 50 MOhm, 9999 uF",
      "true_rms": true,
      "safety_rating": "CAT III 1000V / CAT IV 600V"
    }
  },
  {
    "id": "AST-SOLDER-201-01",
    "code": "TS-2024-00703",
    "name": "Trạm hàn điều chỉnh nhiệt độ Hakko FX-888D",
    "category": "lab_instrument",
    "room_id": "lab-a10-201",
    "room_code": "A10-201",
    "org_path": "/haui/truong-dien-dien-tu/khoa-dien/lab-a10-201",
    "tech_unit_path": "/haui/truong-dien-dien-tu/khoa-dien",
    "model": "Hakko FX-888D Solder Station",
    "serial_number": "SN-HAKKO-FX888D-00703",
    "purchase_year": 2023,
    "warranty_expiry": "2025-04-30",
    "original_value_vnd": 2800000,
    "current_value_vnd": 2000000,
    "status": "in_use",
    "specifications": {
      "power_w": 70,
      "temp_range_celsius": "50-480",
      "temp_stability": "+/- 1.0 C",
      "voltage": "220V AC"
    }
  }
]
